{
  "_comment": "SELF-HOST variant of descriptors/ceos-lab-readonly-descriptor.json for the firewall-a3-partner-path use case: identical tools/schemas, endpoint = the rig running ON THE SAME HOST as your hub (127.0.0.1:3107). The hub admits it only when HUB_PRIVATE_ENDPOINT_ALLOWLIST lists 127.0.0.1:3107 (docs/RUNNING.md \u2192 Registering a service on your own network). The pipeline's Harvester fetches this file from its raw GitHub URL and self-provisions the service (register \u2192 read-only calls \u2192 teardown).",
  "name": "ceos-lab-readonly",
  "description": "Read-only Arista EOS network-state harvest for the network-provisioning pipeline. Exposes list_devices, fetch_data (NAPALM getters: running-config, interfaces, facts, BGP neighbors, etc.), and show_commands restricted to an enumerated allowlist of state-read commands (route tables, OSPF/IS-IS neighbors, IS-IS hostname map) against a cEOS lab. Authenticates to devices with a static service credential (validation rig; not JWKS per-user identity). No preconditions; call fetch_data with getter names, or show_commands with allowlisted commands.",
  "endpoint": "http://127.0.0.1:3107/mcp",
  "category": "automation",
  "version": "0.3.1",
  "capabilities": {
    "transport": "streamable-http",
    "tools": [
      {
        "name": "list_devices",
        "description": "List network devices and inventory (devices, groups, or both). Read-only. Call this first to discover device names before fetch_data.",
        "inputSchema": {
          "type": "object",
          "properties": {
            "query_type": {
              "type": "string",
              "enum": [
                "devices",
                "groups",
                "all"
              ],
              "default": "all",
              "description": "Inventory data to return: 'devices', 'groups', or 'all'"
            },
            "details": {
              "type": "boolean",
              "default": false,
              "description": "Return full device attributes (for a devices query)"
            },
            "filter_name": {
              "type": "string",
              "description": "Filter by inventory device name (e.g. 'ceos1')"
            },
            "filter_hostname": {
              "type": "string",
              "description": "Filter by hostname / IP"
            },
            "filter_group": {
              "type": "string",
              "description": "Filter by group (e.g. 'arista_eos')"
            },
            "filter_platform": {
              "type": "string",
              "description": "Filter by platform (e.g. 'eos')"
            }
          }
        }
      },
      {
        "name": "fetch_data",
        "description": "Execute one or more READ-ONLY NAPALM getters against the EOS devices and return structured state (running-config, interfaces, facts, BGP neighbors, etc.). This is the Phase-0 harvest surface. Read-only by construction \u2014 NAPALM getters never mutate device state.",
        "inputSchema": {
          "type": "object",
          "required": [
            "getters"
          ],
          "properties": {
            "getters": {
              "type": "array",
              "description": "NAPALM getter names to run (short form, no 'get_' prefix). All entries are read-only EOS getters.",
              "minItems": 1,
              "items": {
                "type": "string",
                "enum": [
                  "config",
                  "facts",
                  "interfaces",
                  "interfaces_ip",
                  "interfaces_counters",
                  "lldp_neighbors",
                  "lldp_neighbors_detail",
                  "bgp_neighbors",
                  "bgp_config",
                  "environment",
                  "arp_table",
                  "mac_address_table",
                  "ntp_servers",
                  "snmp_information",
                  "users",
                  "optics",
                  "network_instances"
                ]
              }
            },
            "getters_options": {
              "type": "object",
              "description": "Optional per-getter options, e.g. {\"config\": {\"retrieve\": \"running\"}}.",
              "additionalProperties": true
            },
            "filter_name": {
              "type": "string",
              "description": "Restrict to one inventory device name (e.g. 'ceos1')"
            },
            "filter_hostname": {
              "type": "string",
              "description": "Restrict by hostname / IP"
            },
            "filter_group": {
              "type": "string",
              "description": "Restrict by group"
            },
            "filter_platform": {
              "type": "string",
              "description": "Restrict by platform"
            }
          }
        }
      },
      {
        "name": "show_commands",
        "description": "Execute READ-ONLY operational 'show' commands from the enumerated allowlist and return raw CLI output: route-table, IGP-adjacency and link-state-database state the structured getters cannot retrieve. While one IGP is administratively preferred, the other's routes are computed but not installed, so routing-table views show them absent on a healthy fabric; the link-state database holds that evidence. Commands outside the allowlist are not part of this service; do not send them.",
        "inputSchema": {
          "type": "object",
          "required": [
            "commands"
          ],
          "properties": {
            "commands": {
              "type": "array",
              "minItems": 1,
              "description": "Allowlisted read-only show commands to run on the filtered devices.",
              "items": {
                "type": "string",
                "enum": [
                  "show ip route",
                  "show ip route ospf",
                  "show ip route isis",
                  "show ip ospf neighbor",
                  "show isis neighbor",
                  "show isis hostname",
                  "show ip ospf interface brief",
                  "show isis database",
                  "show isis database detail"
                ]
              }
            },
            "filter_name": {
              "type": "string",
              "description": "Restrict to one inventory device name (e.g. 'ceos1')"
            },
            "filter_hostname": {
              "type": "string",
              "description": "Restrict by hostname / IP"
            },
            "filter_group": {
              "type": "string",
              "description": "Restrict by group"
            },
            "filter_platform": {
              "type": "string",
              "description": "Restrict by platform"
            }
          }
        }
      }
    ]
  }
}
